### ISSUE TITLE
Cannot connect remotely to delve

### ISSUE THREAD

**Issue by zefciu** [derekparker/delve#571]
Hello running delve 0.11.0-alpha with go 1.6.1 on ubuntu amd64
I run k8s api server with command:

```
sudo -E "${GOPATH}/bin/dlv" exec --headless --listen="localhost:8001" "${GO_OUT}/hyperkube" -- apiserver \
# ... more hyperkube-specific args follow
```

Now I connect with:
```
dlv connect 127.0.0.1:8001
```
What I get however if I try to execute any dlv command is:
```
(dlv) funcs
Command failed: json: cannot unmarshal object into Go value of type string
```
The output of `tcpdump -ilo -X` is:
```
13:41:23.290294 IP localhost.52550 > localhost.8001: Flags [P.], seq 1:70, ack 1, win 342, options [nop,nop,TS val 3173949 ecr 3172678], length 69
        0x0000:  4500 0079 1c76 4000 4006 2007 7f00 0001  E..y.v@.@.......
        0x0010:  7f00 0001 cd46 1f41 e716 7533 f255 a9c4  .....F.A..u3.U..
        0x0020:  8018 0156 fe6d 0000 0101 080a 0030 6e3d  ...V.m.......0n=
        0x0030:  0030 6946 7b22 6d65 7468 6f64 223a 2252  .0iF{"method":"R
        0x0040:  5043 5365 7276 6572 2e4c 6973 7446 756e  PCServer.ListFun
        0x0050:  6374 696f 6e73 222c 2270 6172 616d 7322  ctions","params"
        0x0060:  3a5b 7b22 4669 6c74 6572 223a 2222 7d5d  :[{"Filter":""}]
        0x0070:  2c22 6964 223a 307d 0a                   ,"id":0}.
13:41:23.290308 IP localhost.8001 > localhost.52550: Flags [.], ack 70, win 342, options [nop,nop,TS val 3173949 ecr 3173949], length 0
        0x0000:  4500 0034 c082 4000 4006 7c3f 7f00 0001  E..4..@.@.|?....
        0x0010:  7f00 0001 1f41 cd46 f255 a9c4 e716 7578  .....A.F.U....ux
        0x0020:  8010 0156 fe28 0000 0101 080a 0030 6e3d  ...V.(.......0n=
        0x0030:  0030 6e3d                                .0n=
13:41:23.290458 IP localhost.8001 > localhost.52550: Flags [P.], seq 1:93, ack 70, win 342, options [nop,nop,TS val 3173949 ecr 3173949], length 92
        0x0000:  4500 0090 c083 4000 4006 7be2 7f00 0001  E.....@.@.{.....
        0x0010:  7f00 0001 1f41 cd46 f255 a9c4 e716 7578  .....A.F.U....ux
        0x0020:  8018 0156 fe84 0000 0101 080a 0030 6e3d  ...V.........0n=
        0x0030:  0030 6e3d 7b22 6964 223a 302c 2272 6573  .0n={"id":0,"res
        0x0040:  756c 7422 3a6e 756c 6c2c 2265 7272 6f72  ult":null,"error
        0x0050:  223a 226a 736f 6e3a 2063 616e 6e6f 7420  ":"json:.cannot.
        0x0060:  756e 6d61 7273 6861 6c20 6f62 6a65 6374  unmarshal.object
        0x0070:  2069 6e74 6f20 476f 2076 616c 7565 206f  .into.Go.value.o
        0x0080:  6620 7479 7065 2073 7472 696e 6722 7d0a  f.type.string"}.
13:41:23.290465 IP localhost.52550 > localhost.8001: Flags [.], ack 93, win 342, options [nop,nop,TS val 3173949 ecr 3173949], length 0
        0x0000:  4500 0034 1c77 4000 4006 204b 7f00 0001  E..4.w@.@..K....
        0x0010:  7f00 0001 cd46 1f41 e716 7578 f255 aa20  .....F.A..ux.U..
        0x0020:  8010 0156 fe28 0000 0101 080a 0030 6e3d  ...V.(.......0n=
        0x0030:  0030 6e3d                                .0n=
```
So the problem must originate on the server side. But I don't know what is exactly happening here. There seems to be a correct JSON in the request.

**Comment by aarzilli** [comment]
Pass `--api-version=2` to the server.

**Comment by zefciu** [comment]
Thank you. This fixes this problem (I believe however, that it's still a bug)
